{
  "$schema": "https://json-schema.org/draft/2020-12/schema",
  "$id": "semgraph:kpiTile/request",
  "title": "kpiTile request",
  "description": "One number with a mandatory comparison, and a mini trend of the blocks before it: the last block is the number. Give either window (rolling windows) or unit (calendar periods). The warehouse computes each block and, in previous, the value it is compared with (REQ-058).",
  "type": "object",
  "additionalProperties": false,
  "required": [
    "semgraph",
    "metric",
    "measureType",
    "statistic",
    "points"
  ],
  "properties": {
    "semgraph": {
      "const": "kpiTile"
    },
    "metric": {
      "description": "Identifier of the metric, e.g. creditLeads. Used as title when no title is given.",
      "type": "string",
      "pattern": "^[A-Za-z][A-Za-z0-9_]{0,63}$"
    },
    "title": {
      "description": "Title above the chart. States what is shown, not a conclusion.",
      "type": "string",
      "minLength": 1,
      "maxLength": 120
    },
    "measureType": {
      "description": "Kind of number: additive or unique for a count, perUnit for a mean or median per unit such as an amount per lead (REQ-070). ratio, a share with a numerator and a denominator, is not available yet. Required until Domain Hub or the dbt YAML supplies it.",
      "enum": [
        "additive",
        "unique",
        "perUnit",
        "ratio"
      ]
    },
    "uniqueAggregation": {
      "description": "Required for unique counts: daily (the uniques per day; never summed) or overPeriod (the uniques over the whole block, counted in the warehouse; only as a total).",
      "enum": [
        "daily",
        "overPeriod"
      ]
    },
    "statistic": {
      "description": "The value both lines show: sum (the total per block, a square), mean (a diamond with ±1 sd) or median (a dot with P25–P75). A block carries only the fields of this statistic.",
      "enum": [
        "sum",
        "mean",
        "median"
      ]
    },
    "window": {
      "description": "Rolling windows of this many days: 1 or a multiple of 7. Give either window or unit.",
      "type": "integer",
      "minimum": 1,
      "maximum": 364
    },
    "unit": {
      "description": "Calendar periods: week (ISO), month, quarter or year. Give either unit or window.",
      "enum": [
        "week",
        "month",
        "quarter",
        "year"
      ]
    },
    "asOf": {
      "description": "The last complete day of the data. A calendar period that ends after it is still running. Yesterday in Brussels when absent.",
      "type": "string",
      "pattern": "^[0-9]{4}-[0-9]{2}-[0-9]{2}$"
    },
    "format": {
      "description": "Output format. Only svg is available in v0.",
      "enum": [
        "svg",
        "png",
        "html",
        "widget"
      ],
      "default": "svg"
    },
    "locale": {
      "description": "Language of titles, labels and messages, e.g. en or nl-BE. Unknown locales fall back to English.",
      "type": "string",
      "pattern": "^[A-Za-z]{2,3}(-[A-Za-z0-9]{2,8})*$"
    },
    "context": {
      "description": "Provenance and status for the footer. Missing values are shown as unknown.",
      "type": "object",
      "additionalProperties": false,
      "properties": {
        "domain": {
          "type": "string",
          "minLength": 1,
          "maxLength": 80
        },
        "dataset": {
          "type": "string",
          "minLength": 1,
          "maxLength": 80
        },
        "owner": {
          "type": "string",
          "minLength": 1,
          "maxLength": 80
        },
        "reliability": {
          "type": "string",
          "minLength": 1,
          "maxLength": 80
        },
        "definitionUrl": {
          "type": "string",
          "minLength": 1,
          "maxLength": 500
        }
      }
    },
    "meta": {
      "description": "Metadata of the chart (REQ-010): the question that started it, references, the query, who asked and who built it, and the day it was compiled. Only what is given is shown (REQ-020).",
      "type": "object",
      "additionalProperties": false,
      "properties": {
        "question": {
          "description": "The question that started the chart.",
          "type": "string",
          "minLength": 1,
          "maxLength": 1000
        },
        "askedBy": {
          "description": "Who asked the question.",
          "type": "string",
          "minLength": 1,
          "maxLength": 80
        },
        "builtBy": {
          "description": "Who built the chart.",
          "type": "string",
          "minLength": 1,
          "maxLength": 80
        },
        "references": {
          "description": "Links to Jira, Slack or anything else.",
          "type": "array",
          "minItems": 1,
          "maxItems": 10,
          "items": {
            "type": "object",
            "additionalProperties": false,
            "required": [
              "url"
            ],
            "properties": {
              "label": {
                "type": "string",
                "minLength": 1,
                "maxLength": 120
              },
              "url": {
                "type": "string",
                "minLength": 1,
                "maxLength": 500
              }
            }
          }
        },
        "query": {
          "description": "The query behind the data, shown as written.",
          "type": "string",
          "minLength": 1,
          "maxLength": 10000
        },
        "compiledOn": {
          "description": "The day the chart was compiled. When absent, the day it is drawn, in Brussels.",
          "type": "string",
          "pattern": "^[0-9]{4}-[0-9]{2}-[0-9]{2}$"
        }
      }
    },
    "points": {
      "description": "One row per block, oldest first or in any order, computed in the warehouse (REQ-058). The last block is the number; the blocks before it make the mini trend.",
      "type": "array",
      "minItems": 1,
      "maxItems": 1000,
      "items": {
        "type": "object",
        "additionalProperties": false,
        "properties": {
          "end": {
            "description": "With window: the last day of the window.",
            "type": "string",
            "pattern": "^[0-9]{4}-[0-9]{2}-[0-9]{2}$"
          },
          "period": {
            "description": "With unit: the ISO name of the period.",
            "type": "string",
            "pattern": "^[0-9]{4}(-W[0-9]{2}|-[0-9]{2}|-Q[1-4])?$"
          },
          "sum": {
            "type": [
              "number",
              "null"
            ],
            "minimum": 0,
            "description": "The total of the block; null when the block has no data."
          },
          "mean": {
            "type": [
              "number",
              "null"
            ],
            "minimum": 0,
            "description": "The mean of the block; null when the block has no data."
          },
          "sd": {
            "description": "Sample standard deviation (n − 1, like STDDEV in BigQuery).",
            "type": "number",
            "minimum": 0
          },
          "n": {
            "description": "Number of observations behind the value, as counted where the value is computed (REQ-043).",
            "type": "integer",
            "minimum": 1
          },
          "median": {
            "type": [
              "number",
              "null"
            ],
            "minimum": 0,
            "description": "The median of the block; null when the block has no data."
          },
          "p25": {
            "description": "25th percentile (like PERCENTILE_CONT in BigQuery).",
            "type": "number",
            "minimum": 0
          },
          "p75": {
            "description": "75th percentile.",
            "type": "number",
            "minimum": 0
          },
          "previous": {
            "description": "The value this block is compared with (see comparison), in the field of the statistic; null when it has no data. The last block needs it: a number without a comparison says nothing.",
            "type": [
              "object",
              "null"
            ],
            "additionalProperties": false,
            "properties": {
              "sum": {
                "type": [
                  "number",
                  "null"
                ],
                "minimum": 0
              },
              "mean": {
                "type": [
                  "number",
                  "null"
                ],
                "minimum": 0
              },
              "median": {
                "type": [
                  "number",
                  "null"
                ],
                "minimum": 0
              }
            }
          }
        }
      }
    },
    "comparison": {
      "description": "What the number is compared with: previousPeriod (the block just before) or lastYear (the same block a year earlier), as delivered in previous (REQ-067). Default: the period before for a window of up to 14 days, last year for longer windows and calendar periods. With lastYear, the mini trend shows last year as a grey shadow line.",
      "enum": [
        "previousPeriod",
        "lastYear"
      ]
    }
  }
}
